New column  has been created to rb , 09-12-2019 02:38:49
New column  has been created to rb , 09-12-2019 02:38:50
New card dfb has been created to  , 09-12-2019 02:38:51
New card adfb  has been created to  , 09-12-2019 02:38:52
Column adfb  has been deleted from  , 09-12-2019 02:38:57
Column dfb has been deleted from  , 09-12-2019 02:38:58
Column  has been deleted from rb , 09-12-2019 02:39:00
New column  has been created to rb , 09-12-2019 02:39:04
Column  has been deleted from rb , 09-12-2019 02:39:05
Column  has been deleted from rb , 09-12-2019 02:39:06
